{
  "template": "kanban",
  "version": 1,
  "name": "Kanban",
  "states": {
    "todo": {"name": "To Do", "category": "START_STATE"},
    "in-progress": {"name": "In Progress", "category": "IN_PROGRESS", "wipLimit": 5},
    "done": {"name": "Done", "category": "END_STATE", "outcome": "DELIVERED"},
    "no-go": {
      "name": "No Go",
      "category": "END_STATE",
      "outcome": "DISCONTINUED",
      "onBoard": false
    }
  },
  "stateOrder": ["todo", "in-progress", "done", "no-go"],
  "itemTypes": {
    "task": {"name": "Task"},
    "bug": {"name": "Bug"},
    "epic": {"name": "Epic"}
  },
  "fields": {},
  "settings": {"defaultItemType": "task"}
}
